{
  "schema_version": "nightwatch.incident-commit.v2",
  "incident_id": "incident-example",
  "run_id": "run-example",
  "base_revision": 0,
  "revision": 1,
  "event": {
    "id": "event-example",
    "seq": 1,
    "type": "run.started",
    "occurred_at": "2026-09-10T13:40:00Z",
    "actor": { "kind": "go", "id": "nightwatch-control" },
    "timeline": { "title": "Run started", "summary_zh": "回合開始。" }
  }
}
